#, Name, Size, Link
A, QT Database, 82.9 MB, [Link](https://physionet.org/content/qtdb/1.0.0/)
B, Sleep Heart Health Study PSG Database, 93.6 MB, [Link](https://physionet.org/content/shhpsgdb/1.0.0/)
C, Intracardiac Atrial Fibrillation Database, 102.8 MB, [Link](https://physionet.org/content/iafdb/1.0.0/)
D, MIT-BIH Arrhythmia Database, 104.3 MB, [Link](https://physionet.org/content/mitdb/1.0.0/)
E, T-Wave Alternans Challenge Database, 105.0 MB, [Link](https://physionet.org/content/twadb/1.0.0/)
F, **Stress Recognition in Automobile Drivers**, 108.7 MB, [Link](https://physionet.org/content/drivedb/1.0.0/)
G, VOICED Database, 110 MB, [Link](https://physionet.org/content/voiced/1.0.0/)
H, EEG During Mental Arithmetic Tasks, 175.1 MB, [Link](https://physionet.org/content/eegmat/1.0.0/)
I, Non-Invasive Fetal ECG Arrhythmia Database, 177.7 MB, [Link](https://physionet.org/content/nifeadb/1.0.0/)
J, PAF Prediction Challenge Database, 191.4 MB,  [Link](https://physionet.org/content/afpdb/1.0.0/)
K, MIT-BIH Long-Term ECG Database, 205.4 MB, [Link](https://physionet.org/content/ltdb/1.0.0/)
L, BIDMC-PPG and Respiration Dataset, 207.7 MB, [Link](https://physionet.org/content/bidmc/1.0.0/)
M, MMG Database, 215.7 MB, [Link](https://physionet.org/content/mmgdb/1.0.0/)
N, Term-Preterm EHG Database, 245.4 MB, [Link](https://physionet.org/content/tpehgdb/1.0.1/)
O, MIT-BIH Supraventricular Arrhythmia Database, 52.0 MB, [Link](https://physionet.org/content/svdb/1.0.0/)
P, **Wrist PPG During Exercise**, 49.8 MB,  [Link](https://physionet.org/content/wrist/1.0.0/)
Q, Physiologic Response to Changes in Posture, 54.1 MB, [Link](https://physionet.org/content/prcp/1.0.0/)
R, MIT-BIH Noise Stress Test Database, 67.6 MB, [Link](https://physionet.org/content/nstdb/1.0.0/)
S, MIT-BIH Malignant Ventricular Ectopy Database, 33.1 MB, [Link](https://physionet.org/content/vfdb/1.0.0/)
T, Simulated Fetal Phonocardiograms, 33.7 MB, [Link](https://physionet.org/content/simfpcgdb/1.0.0/)
U, OB-1 Fetal ECG Database, 39.3 MB, [Link](https://physionet.org/content/ob1db/1.0.0/)
V, Term-Preterm EHG DataSet with Tocogram, 39.8 MB, [Link](https://physionet.org/content/tpehgt/1.0.0/)
W, MIT-BIH ST Change Database, 42.0 MB, [Link](https://physionet.org/content/stdb/1.0.0/)
X, Recordings excluded from the NSR DB, 35.8 MB, [Link](https://physionet.org/content/excluded/1.0.0/)
Y, CTU-CHB Intrapartum Cardiotocography Database, 38.0 MB,  [Link](https://physionet.org/content/ctu-uhb-ctgdb/1.0.0/)
